{
  "task_id": "codex-fixed-subagent-delegation-20260407-145034-kewd",
  "work_order_id": "WO-P3-CONTRACT-UPGRADE-001",
  "plan_id": "PLAN-CODEX-FIXED-SUBAGENT-DELEGATION-20260407-145034-KEWD",
  "role": "backend-implementer",
  "task_goal": "完成阶段3：升级合同模板与 schema，使角色委派字段和回执字段表达一致并可被稳定校验。",
  "instruction_source": "docs/plans/codex-fixed-subagent-delegation.md",
  "scope_in": [
    "templates/work_order.example.json",
    "templates/dispatch_packet.example.json",
    "templates/return_packet.example.json",
    "schemas/work_order.schema.json",
    "schemas/dispatch_packet.schema.json",
    "schemas/return_packet.schema.json"
  ],
  "scope_out": [
    "orchestrator 脚本逻辑改造",
    "阶段4及以后路由/验证实现",
    "agents 角色正文与映射文件改造",
    "测试与项目侧入口改造"
  ],
  "read_paths_mandatory": [
    "docs/plans/codex-fixed-subagent-delegation.md",
    "docs/ai/runs/codex-fixed-subagent-delegation-20260407-145034-kewd/plan.json",
    "docs/ai/runs/codex-fixed-subagent-delegation-20260407-145034-kewd/return_packets/RP-P2-ROLE-MAP-FREEZE-001.json",
    "templates/work_order.example.json",
    "templates/dispatch_packet.example.json",
    "templates/return_packet.example.json",
    "schemas/work_order.schema.json",
    "schemas/dispatch_packet.schema.json",
    "schemas/return_packet.schema.json"
  ],
  "read_paths_optional": [
    "skills/global-task-orchestrator/scripts/validate-control-plane.ps1",
    "skills/global-task-orchestrator/scripts/control-plane-common.ps1"
  ],
  "write_paths": [
    "templates/work_order.example.json",
    "templates/dispatch_packet.example.json",
    "templates/return_packet.example.json",
    "schemas/work_order.schema.json",
    "schemas/dispatch_packet.schema.json",
    "schemas/return_packet.schema.json"
  ],
  "write_scope": {
    "policy": "allowlist",
    "paths": [
      "templates/work_order.example.json",
      "templates/dispatch_packet.example.json",
      "templates/return_packet.example.json",
      "schemas/work_order.schema.json",
      "schemas/dispatch_packet.schema.json",
      "schemas/return_packet.schema.json"
    ],
    "notes": "角色委派语义使用 write_scope 说明边界来源；执行落地仍以 write_paths 作为最终写入白名单。",
    "relationship_to_write_paths": "write_scope 不替代 write_paths，二者应保持一致；发生冲突时以 write_paths 为准。"
  },
  "context_paths": [
    "docs/plans/codex-fixed-subagent-delegation.md",
    "templates/work_order.example.json",
    "schemas/work_order.schema.json"
  ],
  "evidence_summary": [
    "阶段3目标是让合同对象显式表达角色委派并稳定承载回收字段。",
    "现有验证器已强依赖 return_packet_id/task_id，但 return_packet schema required 未覆盖。",
    "work_order 目前以 write_paths 为主，需补充 write_scope 口径用于角色委派语义表达。"
  ],
  "constraints": [
    "必须先完整阅读 read_paths_mandatory，evidence_summary 仅作导航。",
    "说明性文本默认中文；字段名、路径、脚本参数、代码标识符保持原样。",
    "保持向后兼容，不破坏现有 validate 和 compile 脚本可运行性。",
    "仅可修改 write_paths，禁止越界。",
    "return_packet 正文必须由执行子代理本人填写，主协调器不得代写。"
  ],
  "change_spec": [
    {
      "path": "templates/work_order.example.json",
      "instructions": [
        "补充 write_scope 示例并与 write_paths 关系写清。",
        "保留 role、required_return_fields、return_packet_path、completion_gate 等核心字段。"
      ]
    },
    {
      "path": "templates/dispatch_packet.example.json",
      "instructions": [
        "对齐阶段3后的字段口径，确保与 work_order 能互相引用。",
        "保持复杂任务施工图字段不缺失。"
      ]
    },
    {
      "path": "templates/return_packet.example.json",
      "instructions": [
        "显式展示 return_packet_id 与 task_id。",
        "保持 required_return_fields 最小集合示例完整。"
      ]
    },
    {
      "path": "schemas/work_order.schema.json",
      "instructions": [
        "补充 write_scope 属性定义（不破坏兼容性）。",
        "校准字段注释/类型，使 role 委派语义可表达。"
      ]
    },
    {
      "path": "schemas/dispatch_packet.schema.json",
      "instructions": [
        "校准与 work_order 对齐的字段表达。",
        "确保复杂任务字段仍可完整验证。"
      ]
    },
    {
      "path": "schemas/return_packet.schema.json",
      "instructions": [
        "将 return_packet_id 与 task_id 纳入 required。",
        "保持既有 required_return_fields 语义兼容。"
      ]
    }
  ],
  "execution_steps": [
    "先升级 schema，再回写三个模板示例。",
    "逐文件检查字段兼容关系后运行 JSON 结构校验。",
    "写入 return_packet 并附验证结果。"
  ],
  "verification_steps": [
    "python -m json.tool templates/work_order.example.json",
    "python -m json.tool templates/dispatch_packet.example.json",
    "python -m json.tool templates/return_packet.example.json",
    "python -m json.tool schemas/work_order.schema.json",
    "python -m json.tool schemas/dispatch_packet.schema.json",
    "python -m json.tool schemas/return_packet.schema.json",
    "python -c \"import json, pathlib; s=json.loads(pathlib.Path('schemas/work_order.schema.json').read_text(encoding='utf-8')); print('write_scope' in s.get('properties', {}))\"",
    "python -c \"import json, pathlib; s=json.loads(pathlib.Path('schemas/return_packet.schema.json').read_text(encoding='utf-8')); r=set(s.get('required', [])); print({'return_packet_id','task_id'}.issubset(r))\""
  ],
  "acceptance_criteria": [
    "模板与 schema 能表达角色委派合同字段。",
    "return_packet schema 与验证器核心字段要求一致。",
    "不破坏现有控制面脚本可运行性。",
    "未触及阶段4+范围文件。"
  ],
  "stop_conditions": [
    "发现需要修改脚本才能保持兼容。",
    "发现字段升级会导致当前阶段已有工单不可被验证。",
    "发现必须越过 write_paths 才能完成目标。"
  ],
  "dispatch_packet_path": "docs/ai/runs/codex-fixed-subagent-delegation-20260407-145034-kewd/dispatch_packets/DP-P3-CONTRACT-UPGRADE-001.json",
  "return_packet_path": "docs/ai/runs/codex-fixed-subagent-delegation-20260407-145034-kewd/return_packets/RP-P3-CONTRACT-UPGRADE-001.json",
  "return_packet_required": true,
  "required_return_fields": [
    "return_packet_id",
    "task_id",
    "work_order_id",
    "status",
    "summary",
    "changed_files",
    "planned_files_not_changed",
    "verification_commands",
    "verification_result",
    "deviations_from_dispatch",
    "blocked_by",
    "risks",
    "follow_up_needed",
    "written_by",
    "written_role"
  ],
  "completion_gate": "return_packet_written_and_accepted",
  "state_owner": "main-coordinator",
  "dispatch_message_raw": "你是阶段3执行子代理，负责合同模板与 schema 升级。必须先完整阅读 read_paths_mandatory，再动手。仅修改 write_paths，保持兼容，不要让现有 validate/compile 脚本失效。你不是独占代码库，不要回退他人改动。说明性文本默认中文。return_packet 正文必须由执行子代理本人填写，主协调器不得代写。完成前先写入 return_packet；若信息不足或需越界，返回 blocked。"
}
