{
    "task_id":  "contract-first-dispatch-batch3-4-20260403-153206-gtm2",
    "work_order_id":  "WO-B4-VALIDATE-DISPATCH-001",
    "plan_id":  "PLAN-CONTRACT-FIRST-DISPATCH-BATCH3-4-20260403-153206-GTM2",
    "role":  "dispatch-packet-gate-hardener",
    "task_goal":  "为 Batch 4 补上 `dispatch_packet` 复杂任务门槛校验，并让当前 task 的 control-plane validate 与集成测试通过。",
    "instruction_source":  "docs/plans/contract-first-dispatch.md",
    "read_paths_mandatory":  [
                                 "docs/plans/contract-first-dispatch.md",
                                 "docs/plans/contract-first-dispatch-batch3-4-20260403-153206-gtm2.plan.json",
                                 "docs/ai/runs/contract-first-dispatch-batch3-4-20260403-153206-gtm2/plan.json",
                                 "docs/SUBAGENT_GOVERNANCE.md",
                                 "skills/global-task-orchestrator/SKILL.md",
                                 "skills/global-task-orchestrator/scripts/validate-control-plane.ps1",
                                 "docs/ai/runs/contract-first-dispatch-batch3-4-20260403-153206-gtm2/work_orders/WO-B4-TEST-SUITE-001.json"
                             ],
    "read_paths_optional":  [
                                "docs/ai/runs/contract-first-dispatch-batch3-4-20260403-153206-gtm2/return_packets/RP-B4-TEST-SUITE-001.json",
                                "docs/ai/runs/contract-first-dispatch-batch3-4-20260403-153206-gtm2/dispatch_packets/DP-B35-TEMPLATE-HARDEN-001.json"
                            ],
    "context_paths":  [
                          "docs/plans/contract-first-dispatch.md",
                          "docs/SUBAGENT_GOVERNANCE.md"
                      ],
    "scope_in":  [
                     "skills/global-task-orchestrator/scripts/validate-control-plane.ps1"
                 ],
    "scope_out":  [
                      "不得修改任何测试文件、fixture、README 或其它 control-plane 脚本。",
                      "不得扩展到 Batch 4 之外的测试框架能力。"
                  ],
    "write_paths":  [
                        "skills/global-task-orchestrator/scripts/validate-control-plane.ps1",
                        "docs/ai/runs/contract-first-dispatch-batch3-4-20260403-153206-gtm2/return_packets/RP-B4-VALIDATE-DISPATCH-001.json"
                    ],
    "evidence_summary":  [
                             "Batch 4 范围明确包含 `dispatch_packet` 复杂任务门槛校验。",
                             "当前 validate 已覆盖 mandatory reads、中文输出、正文所有权与回执字段完整性，但尚未拦截复杂任务缺少 `dispatch_packet`。",
                             "Batch 4 测试工单会围绕该缺口设置 bad path，用于验证脚本修复后的黑盒行为。"
                         ],
    "constraints":  [
                        "只修改 `validate-control-plane.ps1`。",
                        "复杂任务门槛必须面向外部行为，不得依赖私有 helper 名称或临时目录名。",
                        "当前 task 中已验收的历史 Batch 3 工单可维持过渡豁免，不得为修闸门回改旧批次产物。"
                    ],
    "change_spec":  [
                        {
                            "path":  "skills/global-task-orchestrator/scripts/validate-control-plane.ps1",
                            "instructions":  [
                                                 "补充复杂任务门槛：当 work_order 体现多文件 / 多改动复杂性时，必须存在 `dispatch_packet_path` 且目标文件存在。",
                                                 "对对应 `dispatch_packet` 至少检查 `read_before_write`、`execution_order`、`change_spec` 为非空；必要时检查 `verification_focus` 或 `handoff_notes`。",
                                                 "保持现有 mandatory reads / 中文输出 / 正文所有权闸门。"
                                             ],
                            "done_when":  [
                                              "validate 能对复杂任务缺少 `dispatch_packet` 或 `dispatch_packet` 关键字段为空给出明确错误。"
                                          ]
                        }
                    ],
    "execution_steps":  [
                            "阅读必读文件与测试工单定义的 bad path。",
                            "更新 `validate-control-plane.ps1` 的复杂任务门槛。",
                            "运行当前 task 的 `validate` 命令；如测试工单已存在，再运行其测试脚本或等待主协调器安排复跑。",
                            "先写 `return_packet`，再回报。"
                        ],
    "acceptance_criteria":  [
                                "`validate-control-plane.ps1` 能阻断复杂任务缺少 `dispatch_packet_path`。",
                                "`validate-control-plane.ps1` 能阻断 `dispatch_packet` 缺关键施工图字段。",
                                "更新后当前 task 的 `validate` 命令通过。"
                            ],
    "verification_steps":  [
                               "Select-String -Path \u0027skills/global-task-orchestrator/scripts/validate-control-plane.ps1\u0027 -Pattern \u0027dispatch_packet_path\u0027,\u0027read_before_write\u0027,\u0027execution_order\u0027,\u0027change_spec\u0027,\u0027verification_focus\u0027 -SimpleMatch",
                               "powershell -ExecutionPolicy Bypass -File .\\skills\\global-task-orchestrator\\scripts\\orchestrator_ctl.ps1 -Action validate -TaskId contract-first-dispatch-batch3-4-20260403-153206-gtm2 -RepoRoot C:\\Users\\72385\\dev\\ai-harness"
                           ],
    "stop_conditions":  [
                            "需要修改测试文件或其它脚本才可继续。",
                            "复杂任务门槛无法在现有 control-plane 字段内表达。"
                        ],
    "return_packet_path":  "docs/ai/runs/contract-first-dispatch-batch3-4-20260403-153206-gtm2/return_packets/RP-B4-VALIDATE-DISPATCH-001.json",
    "return_packet_required":  true,
    "required_return_fields":  [
                                   "work_order_id",
                                   "status",
                                   "summary",
                                   "changed_files",
                                   "planned_files_not_changed",
                                   "verification_commands",
                                   "verification_result",
                                   "deviations_from_dispatch",
                                   "blocked_by",
                                   "risks",
                                   "follow_up_needed",
                                   "written_by",
                                   "written_role"
                               ],
    "completion_gate":  "return_packet_written_and_accepted",
    "state_owner":  "main-coordinator",
    "dispatch_message_raw":  "你是 `dispatch-packet-gate-hardener` 执行子代理。\n先完整阅读 `read_paths_mandatory`，`evidence_summary` 仅作导航，不能代替原文件阅读。\n说明性文本默认中文；字段名、路径、脚本参数、代码标识符保持原样。\n\n任务目标：\n- 为 Batch 4 补上 `dispatch_packet` 复杂任务门槛校验，并让当前 task 的 control-plane validate 与集成测试通过。\n\n必读上下文：\n- `docs/plans/contract-first-dispatch.md`\n- `docs/plans/contract-first-dispatch-batch3-4-20260403-153206-gtm2.plan.json`\n- `docs/ai/runs/contract-first-dispatch-batch3-4-20260403-153206-gtm2/plan.json`\n- `docs/SUBAGENT_GOVERNANCE.md`\n- `skills/global-task-orchestrator/SKILL.md`\n- `skills/global-task-orchestrator/scripts/validate-control-plane.ps1`\n- `docs/ai/runs/contract-first-dispatch-batch3-4-20260403-153206-gtm2/work_orders/WO-B4-TEST-SUITE-001.json`\n\n导航摘要：\n- Batch 4 范围明确包含 `dispatch_packet` 复杂任务门槛校验。\n- 当前 validate 已覆盖 mandatory reads、中文输出、正文所有权与回执字段完整性，但尚未拦截复杂任务缺少 `dispatch_packet`。\n- Batch 4 测试工单会围绕该缺口设置 bad path，用于验证脚本修复后的黑盒行为。\n\n唯一写入范围：\n- `skills/global-task-orchestrator/scripts/validate-control-plane.ps1`\n- `docs/ai/runs/contract-first-dispatch-batch3-4-20260403-153206-gtm2/return_packets/RP-B4-VALIDATE-DISPATCH-001.json`\n\n禁改范围：\n- 不得修改任何测试文件、fixture、README 或其它 control-plane 脚本。\n- 不得扩展到 Batch 4 之外的测试框架能力。\n\n执行约束：\n- 只修改 `validate-control-plane.ps1`。\n- 复杂任务门槛必须面向外部行为，不得依赖私有 helper 名称或临时目录名。\n- 当前 task 中已验收的历史 Batch 3 工单可维持过渡豁免，不得为修闸门回改旧批次产物。\n\n逐文件改法：\n- `skills/global-task-orchestrator/scripts/validate-control-plane.ps1`: 补充复杂任务门槛：当 work_order 体现多文件 / 多改动复杂性时，必须存在 `dispatch_packet_path` 且目标文件存在。；对对应 `dispatch_packet` 至少检查 `read_before_write`、`execution_order`、`change_spec` 为非空；必要时检查 `verification_focus` 或 `handoff_notes`。；保持现有 mandatory reads / 中文输出 / 正文所有权闸门。\n\n执行步骤：\n- 阅读必读文件与测试工单定义的 bad path。\n- 更新 `validate-control-plane.ps1` 的复杂任务门槛。\n- 运行当前 task 的 `validate` 命令；如测试工单已存在，再运行其测试脚本或等待主协调器安排复跑。\n- 先写 `return_packet`，再回报。\n\n验收标准：\n- `validate-control-plane.ps1` 能阻断复杂任务缺少 `dispatch_packet_path`。\n- `validate-control-plane.ps1` 能阻断 `dispatch_packet` 缺关键施工图字段。\n- 更新后当前 task 的 `validate` 命令通过。\n\n验证步骤：\n- Select-String -Path \u0027skills/global-task-orchestrator/scripts/validate-control-plane.ps1\u0027 -Pattern \u0027dispatch_packet_path\u0027,\u0027read_before_write\u0027,\u0027execution_order\u0027,\u0027change_spec\u0027,\u0027verification_focus\u0027 -SimpleMatch\n- powershell -ExecutionPolicy Bypass -File .\\skills\\global-task-orchestrator\\scripts\\orchestrator_ctl.ps1 -Action validate -TaskId contract-first-dispatch-batch3-4-20260403-153206-gtm2 -RepoRoot C:\\Users\\72385\\dev\\ai-harness\n\n停止条件：\n- 需要修改测试文件或其它脚本才可继续。\n- 复杂任务门槛无法在现有 control-plane 字段内表达。\n\n回执要求：\n- `return_packet` 正文必须由执行子代理本人填写，主协调器不得代写。\n- `return_packet_path`: `docs/ai/runs/contract-first-dispatch-batch3-4-20260403-153206-gtm2/return_packets/RP-B4-VALIDATE-DISPATCH-001.json`\n- `completion_gate`: `return_packet_written_and_accepted`\n- 若信息不足以安全实施，返回 `blocked`，不要猜测。\n- 完成前先写 `return_packet`，再声明完成。"
}
