{
    "task_id":  "contract-first-dispatch-batch3-4-20260403-153206-gtm2",
    "work_order_id":  "WO-B3-RETURN-PROMPT-001",
    "plan_id":  "PLAN-CONTRACT-FIRST-DISPATCH-BATCH3-4-20260403-153206-GTM2",
    "role":  "return-packet-prompt-compiler",
    "task_goal":  "把 Batch 3 的回执型提示词真源升级到现有 v2 回执字段语义，但仅停留在提示词正文层。",
    "instruction_source":  "docs/plans/contract-first-dispatch.md",
    "read_paths_mandatory":  [
                                 "docs/plans/contract-first-dispatch.md",
                                 "docs/plans/contract-first-dispatch-batch3-4-20260403-153206-gtm2.plan.json",
                                 "docs/ai/runs/contract-first-dispatch-batch3-4-20260403-153206-gtm2/plan.json",
                                 "docs/SUBAGENT_GOVERNANCE.md",
                                 "skills/global-task-orchestrator/SKILL.md",
                                 "skills/global-task-orchestrator/assets/prompts/return-packet-writer.md",
                                 "templates/return_packet.example.json"
                             ],
    "read_paths_optional":  [
                                "skills/global-task-orchestrator/scripts/validate-control-plane.ps1",
                                "skills/global-task-orchestrator/scripts/ensure-work-order-fields.ps1"
                            ],
    "context_paths":  [
                          "docs/plans/contract-first-dispatch.md",
                          "docs/SUBAGENT_GOVERNANCE.md",
                          "templates/return_packet.example.json"
                      ],
    "scope_in":  [
                     "skills/global-task-orchestrator/assets/prompts/return-packet-writer.md"
                 ],
    "scope_out":  [
                      "不得修改任何 `templates/*.json`、工作流脚本、治理文档或其他 prompt 真源。",
                      "不得把 `return_packet` 正文所有权约束宣告为脚本验收闸门已完成；该下沉归 Batch 3.5。"
                  ],
    "write_paths":  [
                        "skills/global-task-orchestrator/assets/prompts/return-packet-writer.md",
                        "docs/ai/runs/contract-first-dispatch-batch3-4-20260403-153206-gtm2/return_packets/RP-B3-RETURN-PROMPT-001.json"
                    ],
    "evidence_summary":  [
                             "当前 `return-packet-writer.md` 仍按旧最小字段写回执，未对齐现有 `templates/return_packet.example.json` 的 v2 字段语义。",
                             "Batch 3 可在提示词正文中明确“回执正文必须由执行子代理本人填写、主协调器不得代写”，但真正的模板字段与脚本闸门下沉归 Batch 3.5。"
                         ],
    "constraints":  [
                        "说明性文本默认中文。",
                        "只升级回执提示词正文，不修改模板字段或脚本校验。",
                        "提示词必须强调只写本人实际执行与验证过的事实。"
                    ],
    "change_spec":  [
                        {
                            "path":  "skills/global-task-orchestrator/assets/prompts/return-packet-writer.md",
                            "instructions":  [
                                                 "把最小回执字段说明升级为对齐现有 `return_packet` v2 语义的提示词正文。",
                                                 "显式覆盖 `planned_files_not_changed`、`verification_commands`、`verification_result`、`deviations_from_dispatch`、`blocked_by`、`follow_up_needed` 等表达。",
                                                 "保留并强化：回执正文必须由执行子代理本人填写，主协调器不得代写；未写回执不得宣告完成。"
                                             ],
                            "done_when":  [
                                              "回执型提示词能直接指导执行子代理按 v2 语义写回执，但不越权修改 Batch 3.5 的合同/闸门范围。"
                                          ]
                        }
                    ],
    "execution_steps":  [
                            "阅读必读文件。",
                            "升级 `return-packet-writer.md`。",
                            "运行关键短语校验。",
                            "先写 `return_packet`，再回报。"
                        ],
    "acceptance_criteria":  [
                                "`return-packet-writer.md` 对齐现有 v2 回执语义。",
                                "提示词明确要求回执正文只写本人实际执行与验证过的事实。",
                                "提示词明确“执行子代理本人填写正文、主协调器不得代写”是提示词承载，而非 Batch 3.5 的脚本闸门闭环。"
                            ],
    "verification_steps":  [
                               "Select-String -Path \u0027skills/global-task-orchestrator/assets/prompts/return-packet-writer.md\u0027 -Pattern \u0027planned_files_not_changed\u0027,\u0027verification_commands\u0027,\u0027verification_result\u0027,\u0027deviations_from_dispatch\u0027,\u0027blocked_by\u0027,\u0027follow_up_needed\u0027,\u0027主协调器不得代写\u0027 -SimpleMatch"
                           ],
    "stop_conditions":  [
                            "需要越权修改 `templates/return_packet.example.json` 或任何脚本。",
                            "必读文件仍不足以确定 Batch 3 与 Batch 3.5 的边界。"
                        ],
    "return_packet_path":  "docs/ai/runs/contract-first-dispatch-batch3-4-20260403-153206-gtm2/return_packets/RP-B3-RETURN-PROMPT-001.json",
    "return_packet_required":  true,
    "required_return_fields":  [
                                   "work_order_id",
                                   "status",
                                   "summary",
                                   "changed_files",
                                   "planned_files_not_changed",
                                   "verification_commands",
                                   "verification_result",
                                   "deviations_from_dispatch",
                                   "blocked_by",
                                   "risks",
                                   "follow_up_needed",
                                   "written_by",
                                   "written_role"
                               ],
    "completion_gate":  "return_packet_written_and_accepted",
    "state_owner":  "main-coordinator",
    "dispatch_message_raw":  "你是 `return-packet-prompt-compiler` 执行子代理。\n先完整阅读 `read_paths_mandatory`，`evidence_summary` 仅作导航，不能代替原文件阅读。\n说明性文本默认中文；字段名、路径、脚本参数、代码标识符保持原样。\n\n任务目标：\n- 把 Batch 3 的回执型提示词真源升级到现有 v2 回执字段语义，但仅停留在提示词正文层。\n\n必读上下文：\n- `docs/plans/contract-first-dispatch.md`\n- `docs/plans/contract-first-dispatch-batch3-4-20260403-153206-gtm2.plan.json`\n- `docs/ai/runs/contract-first-dispatch-batch3-4-20260403-153206-gtm2/plan.json`\n- `docs/SUBAGENT_GOVERNANCE.md`\n- `skills/global-task-orchestrator/SKILL.md`\n- `skills/global-task-orchestrator/assets/prompts/return-packet-writer.md`\n- `templates/return_packet.example.json`\n\n导航摘要：\n- 当前 `return-packet-writer.md` 仍按旧最小字段写回执，未对齐现有 `templates/return_packet.example.json` 的 v2 字段语义。\n- Batch 3 可在提示词正文中明确“回执正文必须由执行子代理本人填写、主协调器不得代写”，但真正的模板字段与脚本闸门下沉归 Batch 3.5。\n\n唯一写入范围：\n- `skills/global-task-orchestrator/assets/prompts/return-packet-writer.md`\n- `docs/ai/runs/contract-first-dispatch-batch3-4-20260403-153206-gtm2/return_packets/RP-B3-RETURN-PROMPT-001.json`\n\n禁改范围：\n- 不得修改任何 `templates/*.json`、工作流脚本、治理文档或其他 prompt 真源。\n- 不得把 `return_packet` 正文所有权约束宣告为脚本验收闸门已完成；该下沉归 Batch 3.5。\n\n执行约束：\n- 说明性文本默认中文。\n- 只升级回执提示词正文，不修改模板字段或脚本校验。\n- 提示词必须强调只写本人实际执行与验证过的事实。\n\n逐文件改法：\n- `skills/global-task-orchestrator/assets/prompts/return-packet-writer.md`: 把最小回执字段说明升级为对齐现有 `return_packet` v2 语义的提示词正文。；显式覆盖 `planned_files_not_changed`、`verification_commands`、`verification_result`、`deviations_from_dispatch`、`blocked_by`、`follow_up_needed` 等表达。；保留并强化：回执正文必须由执行子代理本人填写，主协调器不得代写；未写回执不得宣告完成。\n\n执行步骤：\n- 阅读必读文件。\n- 升级 `return-packet-writer.md`。\n- 运行关键短语校验。\n- 先写 `return_packet`，再回报。\n\n验收标准：\n- `return-packet-writer.md` 对齐现有 v2 回执语义。\n- 提示词明确要求回执正文只写本人实际执行与验证过的事实。\n- 提示词明确“执行子代理本人填写正文、主协调器不得代写”是提示词承载，而非 Batch 3.5 的脚本闸门闭环。\n\n验证步骤：\n- Select-String -Path \u0027skills/global-task-orchestrator/assets/prompts/return-packet-writer.md\u0027 -Pattern \u0027planned_files_not_changed\u0027,\u0027verification_commands\u0027,\u0027verification_result\u0027,\u0027deviations_from_dispatch\u0027,\u0027blocked_by\u0027,\u0027follow_up_needed\u0027,\u0027主协调器不得代写\u0027 -SimpleMatch\n\n停止条件：\n- 需要越权修改 `templates/return_packet.example.json` 或任何脚本。\n- 必读文件仍不足以确定 Batch 3 与 Batch 3.5 的边界。\n\n回执要求：\n- `return_packet` 正文必须由执行子代理本人填写，主协调器不得代写。\n- `return_packet_path`: `docs/ai/runs/contract-first-dispatch-batch3-4-20260403-153206-gtm2/return_packets/RP-B3-RETURN-PROMPT-001.json`\n- `completion_gate`: `return_packet_written_and_accepted`\n- 若信息不足以安全实施，返回 `blocked`，不要猜测。\n- 完成前先写 `return_packet`，再声明完成。"
}
