{
    "task_id":  "contract-first-dispatch-batch3-4-20260403-153206-gtm2",
    "work_order_id":  "WO-B35-VALIDATE-GATE-001",
    "plan_id":  "PLAN-CONTRACT-FIRST-DISPATCH-BATCH3-4-20260403-153206-GTM2",
    "role":  "validate-gate-hardener",
    "task_goal":  "给 `validate-control-plane.ps1` 增加 Batch 3.5 的最小拒收与阻断校验：缺 mandatory reads、缺默认中文输出要求、缺回执正文所有权约束不得通过。",
    "instruction_source":  "docs/plans/contract-first-dispatch.md",
    "read_paths_mandatory":  [
                                 "docs/plans/contract-first-dispatch.md",
                                 "docs/plans/contract-first-dispatch-batch3-4-20260403-153206-gtm2.plan.json",
                                 "docs/ai/runs/contract-first-dispatch-batch3-4-20260403-153206-gtm2/plan.json",
                                 "docs/SUBAGENT_GOVERNANCE.md",
                                 "skills/global-task-orchestrator/SKILL.md",
                                 "skills/global-task-orchestrator/scripts/validate-control-plane.ps1",
                                 "docs/ai/runs/contract-first-dispatch-batch3-4-20260403-153206-gtm2/work_orders/WO-B35-TEMPLATE-HARDEN-001.json",
                                 "docs/ai/runs/contract-first-dispatch-batch3-4-20260403-153206-gtm2/work_orders/WO-B35-HYDRATE-GATE-001.json"
                             ],
    "read_paths_optional":  [
                                "skills/global-task-orchestrator/scripts/ensure-work-order-fields.ps1",
                                "skills/global-task-orchestrator/scripts/ensure-return-packet-fields.ps1"
                            ],
    "context_paths":  [
                          "docs/plans/contract-first-dispatch.md",
                          "docs/SUBAGENT_GOVERNANCE.md"
                      ],
    "scope_in":  [
                     "skills/global-task-orchestrator/scripts/validate-control-plane.ps1"
                 ],
    "scope_out":  [
                      "不得修改 `orchestrator_ctl.ps1`、hydrate 脚本、任何模板或 prompt 真源。",
                      "不得实现 Batch 4 的完整测试框架；仅做最小拒收与阻断校验。"
                  ],
    "write_paths":  [
                        "skills/global-task-orchestrator/scripts/validate-control-plane.ps1",
                        "docs/ai/runs/contract-first-dispatch-batch3-4-20260403-153206-gtm2/return_packets/RP-B35-VALIDATE-GATE-001.json"
                    ],
    "evidence_summary":  [
                             "冻结方案已明确 Batch 3.5 需要最小拒收能力：缺 mandatory reads、缺中文输出要求、缺回执正文所有权约束不得收口。",
                             "当前 validate 只校验少量字段存在性，尚未覆盖这三类最小阻断项。",
                             "本工单只做最小校验，不扩展到 Batch 4 的测试实现。"
                         ],
    "constraints":  [
                        "在现有 work_order / return_packet 字段内做文本与存在性校验，不新增 schema。",
                        "默认中文输出约束可通过检查 `dispatch_message_raw` 是否包含固定中文要求实现。",
                        "回执正文所有权约束可通过检查 `dispatch_message_raw` 是否包含固定表述实现。"
                    ],
    "change_spec":  [
                        {
                            "path":  "skills/global-task-orchestrator/scripts/validate-control-plane.ps1",
                            "instructions":  [
                                                 "对 work_order 增加最小阻断校验：`read_paths_mandatory` 不得缺失或为空、`evidence_summary` 不得缺失或为空。",
                                                 "对 `dispatch_message_raw` 增加固定文本检查：必须包含默认中文输出要求，以及 `return_packet` 正文由执行子代理本人填写、主协调器不得代写的表述。",
                                                 "保持当前 `validate` 的 control-plane 结构，不扩展到 Batch 4 的 happy/bad path 测试框架。"
                                             ],
                            "done_when":  [
                                              "validate 能对三类最小阻断项给出明确错误。"
                                          ]
                        }
                    ],
    "execution_steps":  [
                            "阅读必读文件。",
                            "更新 `validate-control-plane.ps1` 的最小阻断校验。",
                            "运行当前 task 的 `validate` 命令，确认更新后仍可通过。",
                            "先写 `return_packet`，再回报。"
                        ],
    "acceptance_criteria":  [
                                "`validate-control-plane.ps1` 能阻断缺 `read_paths_mandatory` 的 work_order。",
                                "`validate-control-plane.ps1` 能阻断缺中文输出要求或缺回执正文所有权表述的 `dispatch_message_raw`。",
                                "更新后 `orchestrator_ctl.ps1 -Action validate -TaskId contract-first-dispatch-batch3-4-20260403-153206-gtm2` 仍通过。"
                            ],
    "verification_steps":  [
                               "Select-String -Path \u0027skills/global-task-orchestrator/scripts/validate-control-plane.ps1\u0027 -Pattern \u0027read_paths_mandatory\u0027,\u0027evidence_summary\u0027,\u0027中文\u0027,\u0027主协调器不得代写\u0027 -SimpleMatch",
                               "powershell -ExecutionPolicy Bypass -File .\\skills\\global-task-orchestrator\\scripts\\orchestrator_ctl.ps1 -Action validate -TaskId contract-first-dispatch-batch3-4-20260403-153206-gtm2 -RepoRoot C:\\Users\\72385\\dev\\ai-harness"
                           ],
    "stop_conditions":  [
                            "需要修改 `orchestrator_ctl.ps1` 才能继续。",
                            "需要引入 Batch 4 测试脚手架才能验证。"
                        ],
    "return_packet_path":  "docs/ai/runs/contract-first-dispatch-batch3-4-20260403-153206-gtm2/return_packets/RP-B35-VALIDATE-GATE-001.json",
    "return_packet_required":  true,
    "required_return_fields":  [
                                   "work_order_id",
                                   "status",
                                   "summary",
                                   "changed_files",
                                   "planned_files_not_changed",
                                   "verification_commands",
                                   "verification_result",
                                   "deviations_from_dispatch",
                                   "blocked_by",
                                   "risks",
                                   "follow_up_needed",
                                   "written_by",
                                   "written_role"
                               ],
    "completion_gate":  "return_packet_written_and_accepted",
    "state_owner":  "main-coordinator",
    "dispatch_message_raw":  "你是 `validate-gate-hardener` 执行子代理。\n先完整阅读 `read_paths_mandatory`，`evidence_summary` 仅作导航，不能代替原文件阅读。\n说明性文本默认中文；字段名、路径、脚本参数、代码标识符保持原样。\n\n任务目标：\n- 给 `validate-control-plane.ps1` 增加 Batch 3.5 的最小拒收与阻断校验：缺 mandatory reads、缺默认中文输出要求、缺回执正文所有权约束不得通过。\n\n必读上下文：\n- `docs/plans/contract-first-dispatch.md`\n- `docs/plans/contract-first-dispatch-batch3-4-20260403-153206-gtm2.plan.json`\n- `docs/ai/runs/contract-first-dispatch-batch3-4-20260403-153206-gtm2/plan.json`\n- `docs/SUBAGENT_GOVERNANCE.md`\n- `skills/global-task-orchestrator/SKILL.md`\n- `skills/global-task-orchestrator/scripts/validate-control-plane.ps1`\n- `docs/ai/runs/contract-first-dispatch-batch3-4-20260403-153206-gtm2/work_orders/WO-B35-TEMPLATE-HARDEN-001.json`\n- `docs/ai/runs/contract-first-dispatch-batch3-4-20260403-153206-gtm2/work_orders/WO-B35-HYDRATE-GATE-001.json`\n\n导航摘要：\n- 冻结方案已明确 Batch 3.5 需要最小拒收能力：缺 mandatory reads、缺中文输出要求、缺回执正文所有权约束不得收口。\n- 当前 validate 只校验少量字段存在性，尚未覆盖这三类最小阻断项。\n- 本工单只做最小校验，不扩展到 Batch 4 的测试实现。\n\n唯一写入范围：\n- `skills/global-task-orchestrator/scripts/validate-control-plane.ps1`\n- `docs/ai/runs/contract-first-dispatch-batch3-4-20260403-153206-gtm2/return_packets/RP-B35-VALIDATE-GATE-001.json`\n\n禁改范围：\n- 不得修改 `orchestrator_ctl.ps1`、hydrate 脚本、任何模板或 prompt 真源。\n- 不得实现 Batch 4 的完整测试框架；仅做最小拒收与阻断校验。\n\n执行约束：\n- 在现有 work_order / return_packet 字段内做文本与存在性校验，不新增 schema。\n- 默认中文输出约束可通过检查 `dispatch_message_raw` 是否包含固定中文要求实现。\n- 回执正文所有权约束可通过检查 `dispatch_message_raw` 是否包含固定表述实现。\n\n逐文件改法：\n- `skills/global-task-orchestrator/scripts/validate-control-plane.ps1`: 对 work_order 增加最小阻断校验：`read_paths_mandatory` 不得缺失或为空、`evidence_summary` 不得缺失或为空。；对 `dispatch_message_raw` 增加固定文本检查：必须包含默认中文输出要求，以及 `return_packet` 正文由执行子代理本人填写、主协调器不得代写的表述。；保持当前 `validate` 的 control-plane 结构，不扩展到 Batch 4 的 happy/bad path 测试框架。\n\n执行步骤：\n- 阅读必读文件。\n- 更新 `validate-control-plane.ps1` 的最小阻断校验。\n- 运行当前 task 的 `validate` 命令，确认更新后仍可通过。\n- 先写 `return_packet`，再回报。\n\n验收标准：\n- `validate-control-plane.ps1` 能阻断缺 `read_paths_mandatory` 的 work_order。\n- `validate-control-plane.ps1` 能阻断缺中文输出要求或缺回执正文所有权表述的 `dispatch_message_raw`。\n- 更新后 `orchestrator_ctl.ps1 -Action validate -TaskId contract-first-dispatch-batch3-4-20260403-153206-gtm2` 仍通过。\n\n验证步骤：\n- Select-String -Path \u0027skills/global-task-orchestrator/scripts/validate-control-plane.ps1\u0027 -Pattern \u0027read_paths_mandatory\u0027,\u0027evidence_summary\u0027,\u0027中文\u0027,\u0027主协调器不得代写\u0027 -SimpleMatch\n- powershell -ExecutionPolicy Bypass -File .\\skills\\global-task-orchestrator\\scripts\\orchestrator_ctl.ps1 -Action validate -TaskId contract-first-dispatch-batch3-4-20260403-153206-gtm2 -RepoRoot C:\\Users\\72385\\dev\\ai-harness\n\n停止条件：\n- 需要修改 `orchestrator_ctl.ps1` 才能继续。\n- 需要引入 Batch 4 测试脚手架才能验证。\n\n回执要求：\n- `return_packet` 正文必须由执行子代理本人填写，主协调器不得代写。\n- `return_packet_path`: `docs/ai/runs/contract-first-dispatch-batch3-4-20260403-153206-gtm2/return_packets/RP-B35-VALIDATE-GATE-001.json`\n- `completion_gate`: `return_packet_written_and_accepted`\n- 若信息不足以安全实施，返回 `blocked`，不要猜测。\n- 完成前先写 `return_packet`，再声明完成。"
}
